Headline,HyperLinks,Tag
France and Spain impose sweeping new restrictions,/news/world-europe-51892477,Europe
UK coronavirus deaths double in 24 hours,/news/uk-51889957,UK
"Olympics will go ahead, says Japan PM",/sport/olympics/51888491,Olympics
Inside the drugs turf war in my hometown,https://www.bbc.co.uk/bbcthree/article/6dd0c35e-edf4-470a-80f2-5be5f0eb6ea3,BBC Three
The soft power roots of K-pop,https://www.bbc.com/culture/story/20200309-the-soft-power-roots-of-k-pop,Did you miss?
US adds UK and Ireland to coronavirus travel ban,/news/world-us-canada-51891662,US & Canada
Italians sing from their windows to defy coronavirus,/news/world-europe-51886547,Europe
Coronavirus: A visual guide to the pandemic,/news/world-51235105,World
What happened on a day without football?,/sport/football/51890573,Football
'Supernatural' Semenya targets 200m,/sport/athletics/51888911,Athletics
Root 'relief' over cancelled Tests,/sport/cricket/51887009,Cricket
The rise of Indonesia’s 'green Islam',http://www.bbc.com/future/article/20200311-can-green-islams-environmental-fatwas-help-climate-change,Future Planet
Can miniature nuclear reactors work?,http://www.bbc.com/future/article/20200309-are-small-nuclear-power-plants-safe-and-efficient,Future Planet
The hidden casualties of wind farms,https://www.bbc.com/future/article/20200302-how-do-wind-farms-affect-bats-birds-and-other-wildlife,Future Planet
New Zealand says all arrivals must self-isolate,/news/world-asia-51885983,Asia
The 'cult' blamed for S Korea's virus outbreak,/news/world-asia-51851250,Asia
As it happened: Coronavirus on Friday,/news/live/world-51866403,World
'A giant robber crab stole my camera',/news/world-australia-51867525,Australia
Working from home amid Covid-19,https://www.bbc.com/worklife/article/20200312-coronavirus-covid-19-update-work-from-home-in-a-pandemic,Worklife
How good is The Plot Against America?,https://www.bbc.com/culture/story/20200311-the-plot-against-americas-vision-feels-eerily-familiar,Culture
How do you clean a space station?,https://www.bbc.com/future/article/20200311-how-do-you-keep-a-space-station-clean,Future
Canada's mysterious lake monster,https://www.bbc.com/travel/story/20200309-ogopogo-the-monster-lurking-in-okanagan-lake,Travel
The ultimate symbol of Japan?,https://www.bbc.com/culture/story/20200305-the-japanese-kimono-status-symbol-to-high-fashion,Designed
St Patrick's Day: The best of Irish cuisine,https://www.bbc.co.uk/food/cuisines/irish,Food
Coronavirus: What are the symptoms?,https://www.bbc.com/news/health-51048366,Health
Are female urinals the answer to queues at the loos?,/news/business,Business
How a 'growth mindset' can lead to success,http://www.bbc.com/worklife,Worklife
Italian patients treated in tents and warehouse,/news/world-europe-51883589,Europe
Italian patients treated in tents and...,/news/world-europe-51883589,Europe
Coronavirus: Do face masks work?,/news/health-51881555,Health
Coronavirus: Indian greeting namaste goes...,/news/world-asia-india-51854798,India
Trump declares US national emergency,/news/world-us-canada-51879699,US & Canada
Inside Wuhan: Watching my wife get...,/news/world-asia-china-51858226,China
Boris Johnson struggles in interview,/news/uk-40358825,UK
Ready for the total solar eclipse?,/news/world-us-canada-40362067,US & Canada
Koalas 'face extinction' in parts of...,/news/world-australia-40365981,Australia
Video 'shows Mosul mosque's destruction',/news/world-middle-east-40366136,Middle East
Indonesia's female 'devil wheel' riders,/news/world-asia-40360168,Asia
Coronavirus: Washing hands no longer 'a...,/news/uk-northern-ireland-51891041,Northern Ireland
Norwegian to suspend half its staff as virus spreads,/news/business-51847882,Business
Europe 'now epicentre of coronavirus pandemic',/news/world-europe-51876784,Europe
How coronavirus is hitting entertainment events,/news/entertainment-arts-51869154,Entertainment & Arts
Will millions more trees really stop climate change?,/news/science-environment-51633560,Science & Environment
"Apple's annual showcase, WWDC, online only",/news/technology-51870733,Technology
Countries enforce mass closures to stem virus,/news/world-51862347,World
How hackers are preying on coronavirus fears,/news/technology-51838468,Technology
Salmon firms seek higher tonnage limits over virus,https://www.bbc.com/news/uk-scotland-scotland-business-51853807,Scotland business
Should commuting time be included in our work hours?,https://www.bbc.com/worklife/article/20200309-should-working-while-you-commute-count-as-paid-time,Worklife
Africa's top shots: Throwing paint and wrapping pythons,/news/world-africa-51850344,Africa
British racing drivers on show at Silverstone,/news/in-pictures-51741637,In Pictures
In pictures: Life under lockdown in Italy,/news/in-pictures-51815536,In Pictures
In pictures: Locust swarms in East Africa,/news/in-pictures-51618188,In Pictures
In pictures: Notre-Dame restoration work,/news/in-pictures-51815537,In Pictures
