Date,Headline,HyperLinks,Tag,Text
17-Mar-20,Coronavirus: Merseyside Police chief constable self-isolates,https://www.bbc.co.uk/news/uk-england-merseyside-51926170,Liverpool,
13-Mar-20,Backpackers document Vietnam hospital isolation,https://www.bbc.co.uk/news/uk-england-london-51878109,London,
16-Mar-20,Coronavirus: Volunteers organise to help vulnerable,https://www.bbc.co.uk/news/uk-wales-51907364,Wales,
17-Mar-20,Pop stars live-stream concerts from home to combat isolation,https://www.bbc.co.uk/news/entertainment-arts-51924765,Entertainment & Arts,
12-Mar-20,Iranian becomes celebrity in Georgia over Covid-19,https://www.bbc.co.uk/news/blogs-news-from-elsewhere-51855041,News from Elsewhere,
16-Mar-20,Biden wants woman VP and other debate takeaways,https://www.bbc.co.uk/news/world-us-canada-51903199,US & Canada,
12-Mar-20,Eurozone bank tries to ease coronavirus crisis,https://www.bbc.co.uk/news/business-51857792,Business,
6-Mar-20,Coronavirus: Hate crime reports rise in Exeter,https://www.bbc.co.uk/news/uk-england-devon-51773774,Devon,
9-Mar-20,Letter from Africa: The spread of coronavirus prejudice in Kenya,https://www.bbc.co.uk/news/world-africa-51770856,Africa,
13-Mar-20,Coronavirus: How Covid-19 could affect your festival plans this summer,https://www.bbc.co.uk/news/newsbeat-51814216,Newsbeat,
13-Mar-20,Coronavirus: What misinformation has spread in Africa?,https://www.bbc.co.uk/news/world-africa-51710617,Africa,
26-Feb-20,Coronavirus: Fake news is spreading fast,https://www.bbc.co.uk/news/technology-51646309,Technology,
16-Aug-18,Corona beer owner to pour $4bn into weed,https://www.bbc.co.uk/news/business-45204186,Business,
13-Mar-20,Transcript: Disabled and out of money in North Korea,https://www.bbc.co.uk/news/disability-51873122,Disability,
11-Feb-20,Coronavirus disease named Covid-19,https://www.bbc.co.uk/news/world-asia-china-51466362,China,
7-Feb-20,Coronavirus: Russian media hint at US conspiracy,https://www.bbc.co.uk/news/world-europe-51413870,Europe,
13-Feb-20,Further increase in Scottish coronavirus testing,https://www.bbc.co.uk/news/uk-scotland-51490381,Scotland,
21-Jan-20,Newspaper headlines: Harry 'flies to Canada' and Lord Hall steps down,https://www.bbc.co.uk/news/blogs-the-papers-51184631,The Papers,
11-Feb-13,Corona Theatre School forced to close,http://www.bbc.co.uk/news/uk-england-london-21410156,London,
29-Dec-19,Why Canada's cannabis bubble burst,https://www.bbc.co.uk/news/world-us-canada-50664578,US & Canada,
31-Jan-13,Budweiser-Corona beer merger opposed by US,http://www.bbc.co.uk/news/business-21275261,Business,
21-Jan-13,Italy paparazzo Fabrizio Corona facing European warrant,http://www.bbc.co.uk/news/world-europe-21127532,Europe,
22-May-12,Philippines judge Renato Corona 'quits trial',http://www.bbc.co.uk/news/world-asia-18162339,Asia,
2-Jun-12,Renato Corona trial: Filipinos gripped by judge's TV trial,http://www.bbc.co.uk/news/world-asia-18294549,Asia,
29-May-12,Philippine top judge Renato Corona faces sack for corruption,http://www.bbc.co.uk/news/world-asia-18249759,Asia,
30-Oct-18,Parker Solar Probe: Nasa's Sun mission smashes records,https://www.bbc.co.uk/news/science-environment-46030852,Science & Environment,
8-Aug-18,Parker Solar Probe: How Nasa is trying to 'touch' the Sun,https://www.bbc.co.uk/news/science-environment-45113552,Science & Environment,
29-Oct-18,In pictures: Astronomy Photographer of the Year 2018,https://www.bbc.co.uk/news/in-pictures-45978380,In Pictures,
16-Dec-19,My Anna Delvey story: Strange encounters with a fake heiress,https://www.bbc.co.uk/news/world-us-canada-50662268,US & Canada,
4-Dec-18,Cannabis firm confirms investment talks with Marlboro maker,https://www.bbc.co.uk/news/business-46435875,Business,
11-Aug-18,Parker Solar Probe: Nasa mission to unlock Sun's mysteries delayed,https://www.bbc.co.uk/news/science-environment-45058911,Science & Environment,
28-Mar-18,Bottle deposit: Recycling the idea of the Pop Man,http://www.bbc.co.uk/news/uk-wales-43573931,Wales,
12-Aug-18,Parker Solar Probe: Nasa launches mission to 'touch the Sun',https://www.bbc.co.uk/news/science-environment-45160722,Science & Environment,
8-Feb-18,Secrets of solar flares are unlocked,http://www.bbc.co.uk/news/science-environment-42979043,Science & Environment,
12-Dec-18,Parker Solar Probe: Sun-skimming mission starts calling home,https://www.bbc.co.uk/news/science-environment-46547588,Science & Environment,
27-Jun-19,Cannabis-laced beer and dog treats excite big firms,https://www.bbc.co.uk/news/business-48718588,Business,
17-Sep-18,Coca-Cola 'in talks' over cannabis-infused drinks,https://www.bbc.co.uk/news/business-45545233,Business,
18-May-17,Rescued seals released back into wild after treatment,http://www.bbc.co.uk/news/uk-england-norfolk-39967875,Norfolk,
28-Jan-18,Italian mafia: How crime families went global,http://www.bbc.co.uk/news/world-europe-42794848,Europe,
25-Feb-16,Budweiser owner AB InBev sees profits drop,http://www.bbc.co.uk/news/business-35660137,Business,
13-Oct-17,"Half-smoked Winston Churchill cigar sold for $12,000",http://www.bbc.co.uk/news/world-us-canada-41604511,US & Canada,
26-Feb-18,Annie Maunder: Astronomer remembered on 150th birthday,http://www.bbc.co.uk/news/uk-northern-ireland-foyle-west-43196177,Foyle & West,
4-May-16,Nasa sculpture plans for Nottingham site unveiled,http://www.bbc.co.uk/news/uk-england-nottinghamshire-36203463,Nottingham,
31-May-17,Nasa renames Sun skimming mission,http://www.bbc.co.uk/news/science-environment-40109110,Science & Environment,
28-Apr-16,San Bernardino attacks: Police arrest gunman's relatives,http://www.bbc.co.uk/news/world-us-canada-36165678,US &amp; Canada,
18-Feb-17,Eclipse to be turned into megamovies,http://www.bbc.co.uk/news/science-environment-38913706,Science & Environment,
9-Jul-10,Oxegen 2010 - The Coronas,http://www.bbc.co.uk/blogs/acrosstheline/2010/07/oxegen_2010_the_coronas.html,Across the Line,
30-Apr-18,Rent costs full-time workers every penny earned until May,https://www.bbc.co.uk/news/uk-england-43881389,England,
18-Sep-18,Solar Orbiter: Spacecraft to leave UK bound for the Sun,https://www.bbc.co.uk/news/science-environment-45553019,Science & Environment,
10-Feb-16,Asahi to buy Peroni and Grolsch,http://www.bbc.co.uk/news/business-35542514,Business,
1-Sep-10,Chattering Classes #21 - The Coronas,http://www.bbc.co.uk/blogs/acrosstheline/2010/09/chatering_classes_19_-_the_cor.html,Across the Line,
4-May-16,Satellite-powered sculpture plan for Nottingham bioscience site,http://www.bbc.co.uk/news/uk-england-nottinghamshire-36203462,Nottingham,
12-Apr-17,Annie Maunder: Plaque to be erected for Strabane astronomer,http://www.bbc.co.uk/news/uk-northern-ireland-foyle-west-39576424,Foyle & West,
28-Sep-16,AB InBev-SAB Miller deal approved by shareholders,http://www.bbc.co.uk/news/business-37493119,Business,
7-Oct-15,SABMiller rejects latest Anheuser-Busch InBev offer,http://www.bbc.co.uk/news/business-34462476,Business,
4-Aug-16,AB InBev to cut up to 575 UK jobs in SABMiller takeover,http://www.bbc.co.uk/news/uk-england-surrey-36977261,Surrey,
17-Oct-18,Cannabis in Canada: Who wins and who loses under new law,https://www.bbc.co.uk/news/world-us-canada-45674260,US & Canada,
20-Jun-15,Mexico beer centre attack leaves 10 dead,http://www.bbc.co.uk/news/world-latin-america-33209778,Latin America & Caribbean,
16-Jan-12,Impeachment trial for top Philippine judge begins,http://www.bbc.co.uk/news/world-asia-16571057,Asia,
11-Oct-15,Clock ticking for AB InBev and SABMiller over deal,http://www.bbc.co.uk/news/business-34499645,Business,
17-Jul-13,Speedy tsunami seen on Sun's surface,http://www.bbc.co.uk/news/science-environment-23241896,Science & Environment,
2-Jul-13,Dead fish fill Mexico reservoir,http://www.bbc.co.uk/news/world-latin-america-23142553,Latin America & Caribbean,
16-Jan-18,Turpin case: Shackled California siblings 'victims of torture',http://www.bbc.co.uk/news/world-us-canada-42709489,US & Canada,
13-May-14,Saudi Arabia: Farmers flout Mers warning by kissing camels,http://www.bbc.co.uk/news/blogs-news-from-elsewhere-27393045,News from Elsewhere,
11-Nov-15,Beer giants AB InBev and SABMiller agree mega-merger,http://www.bbc.co.uk/news/business-34784926,Business,
26-Jul-16,AB InBev raises offer for SABMiller,http://www.bbc.co.uk/news/business-36892960,Business,
16-Aug-11,"Gig News! Coronas, Throwing Muses, Damon Albarn and more...",http://www.bbc.co.uk/blogs/acrosstheline/2011/08/gig_news_coronas_throwing_muse.html,Across the Line,
9-Mar-16,Total eclipse: Indonesia witnesses totality as Sun is blocked by the Moon,http://www.bbc.co.uk/news/science-environment-35756955,Science & Environment,
12-Dec-11,Philippines chief justice impeached by congress,http://www.bbc.co.uk/news/world-asia-16144786,Asia,
23-Nov-13,Ison: The comet of the century,http://www.bbc.co.uk/news/science-environment-25052236,Science & Environment,
29-Jul-16,SABMiller recommends revised AB InBev takeover offer,http://www.bbc.co.uk/news/business-36927296,Business,
4-Oct-16,Chasing the Sun: The woman forgotten by science,http://www.bbc.co.uk/news/science-environment-37496677,Science & Environment,
18-Aug-17,Solar eclipse 2017: What you need to know,http://www.bbc.co.uk/news/world-us-canada-40941341,US & Canada,
21-May-14,MoD rethinks new Salisbury Plain military homes plan,http://www.bbc.co.uk/news/uk-england-wiltshire-27503655,Wiltshire,
12-Oct-15,AB InBev makes higher offer for SABMiller,http://www.bbc.co.uk/news/business-34505589,Business,
8-Oct-15,InBev tells SABMiller: Don't let beer giant merger die,http://www.bbc.co.uk/news/business-34475404,Business,
3-Dec-15,AB InBev mulls Peroni and Grolsch sale in beer merger,http://www.bbc.co.uk/news/business-34993658,Business,
26-Feb-16,Apache to slash spending but prioritise North Sea operations,http://www.bbc.co.uk/news/uk-scotland-scotland-business-35673605,Scotland business,
18-Nov-15,Charity calls for 10p bottle deposit to reduce litter,http://www.bbc.co.uk/news/uk-wales-34846953,Wales,
2-Feb-17,Scientists record breach in magnetic field,http://www.bbc.co.uk/news/science-environment-38849147,Science & Environment,
17-May-10,Row over Philippines judge post,http://news.bbc.co.uk/1/hi/world/asia-pacific/8686791.stm,Asia-Pacific,
19-Apr-16,Peroni and Grolsch brands sold by AB InBev to Asahi,http://www.bbc.co.uk/news/business-36079368,Business,
1-Jul-13,Rocket camera catches Sun 'sparkles',http://www.bbc.co.uk/news/science-environment-23132751,Science & Environment,
28-Feb-11,Oxford scientists say trumpets in daffodils are 'new organ',http://www.bbc.co.uk/news/uk-england-oxfordshire-12598054,Oxford,
13-Mar-14,Italy: Doorbell 'set off deadly Mafia bomb',http://www.bbc.co.uk/news/blogs-news-from-elsewhere-26560525,News from Elsewhere,
25-Nov-15,Leicester Cathedral rooftop cross blessed by climbing dean,http://www.bbc.co.uk/news/uk-england-leicestershire-34911620,Leicester,
12-Aug-15,Pardalian Rostas jailed for raping woman in Glasgow,http://www.bbc.co.uk/news/uk-scotland-glasgow-west-33883040,Glasgow & West Scotland,
7-Jun-13,Comet Lovejoy flies into Sun to reveal solar secrets,http://www.bbc.co.uk/news/science-environment-22803592,Science & Environment,
11-Jan-18,NBA courts UK as Celtics and 76ers look to bounce back,http://www.bbc.co.uk/news/business-41579180,Business,
23-Apr-11,Italian police arrest 'mafia boss' in Puglia,http://www.bbc.co.uk/news/world-europe-13178555,Europe,
22-Jul-14,Dylan Thomas Prize: Swansea University reveals longlist,http://www.bbc.co.uk/news/uk-wales-south-west-wales-28430744,South West Wales,
28-Jun-09,Building work announced for Abbey,http://news.bbc.co.uk/1/hi/england/london/8123241.stm,London,
4-Feb-11,Crews tackle factory fires in Llanelli and Aberbeeg,http://www.bbc.co.uk/news/uk-wales-12363178,Wales,
10-Feb-15,Solar weather: QUB scientists try to predict explosions,http://www.bbc.co.uk/news/uk-northern-ireland-31317970,Northern Ireland,
21-Apr-15,119mph drink driver jailed after PCSO Alwyn Pritchard died,http://www.bbc.co.uk/news/uk-wales-south-east-wales-32391498,South East Wales,
7-Jan-11,Jets implicated in solar riddle,http://www.bbc.co.uk/news/science-environment-12136190,Science & Environment,
13-Oct-15,Beer giants AB InBev and SABMiller agree takeover terms,http://www.bbc.co.uk/news/business-34513520,Business,
15-Jul-15,Pardalian Rostas guilty of raping woman in Glasgow,http://www.bbc.co.uk/news/uk-scotland-glasgow-west-33540203,Glasgow & West Scotland,
16-Sep-15,Beer giants AB InBev and SABMiller in merger talks,http://www.bbc.co.uk/news/business-34268632,Business,
